If I leave home at 8pm, when will I arrive at the airport?	If I leave home at 8 pm , when will I arrive at the airport ?	[IN:GET_ESTIMATED_ARRIVAL If I leave [SL:SOURCE [IN:GET_LOCATION_HOME home ] ] [SL:DATE_TIME_DEPARTURE at 8 pm ] , when will I arrive at [SL:DESTINATION [IN:GET_LOCATION [SL:CATEGORY_LOCATION the airport ] ] ] ? ]
Arrival Time in Baton Rouge leaving from my house at 7 am	Arrival Time in Baton Rouge leaving from my house at 7 am	[IN:GET_ESTIMATED_ARRIVAL Arrival Time in [SL:DESTINATION Baton Rouge ] leaving from [SL:SOURCE [IN:GET_LOCATION_HOME [SL:CONTACT my ] house ] ] [SL:DATE_TIME_DEPARTURE at 7 am ] ]
Can I make it to Moscow and back by 5:00 pm?	Can I make it to Moscow and back by 5 : 00 pm ?	[IN:GET_ESTIMATED_ARRIVAL Can I make it to [SL:WAYPOINT Moscow ] and [SL:DESTINATION [IN:GET_LOCATION [SL:LOCATION_USER back ] ] ] [SL:DATE_TIME_ARRIVAL by 5 : 00 pm ] ? ]
can i make it to the buck game before tipoff if i leave now	can i make it to the buck game before tipoff if i leave now	[IN:GET_ESTIMATED_ARRIVAL can i make it to [SL:DESTINATION [IN:GET_EVENT the [SL:NAME_EVENT buck ] [SL:CATEGORY_EVENT game ] ] ] before tipoff if i leave [SL:DATE_TIME_DEPARTURE now ] ]
If I live in 30 minutes, will I make it to Charlottesville by 5 PM?	If I live in 30 minutes , will I make it to Charlottesville by 5 PM ?	[IN:GET_ESTIMATED_ARRIVAL If I live [SL:DATE_TIME_DEPARTURE in 30 minutes ] , will I make it to [SL:DESTINATION Charlottesville ] [SL:DATE_TIME_ARRIVAL by 5 PM ] ? ]
Taking the 70 can I make it to Perris by 6	Taking the 70 can I make it to Perris by 6	[IN:GET_ESTIMATED_ARRIVAL Taking [SL:PATH the 70 ] can I make it to [SL:DESTINATION Perris ] [SL:DATE_TIME_ARRIVAL by 6 ] ]
What is my ETA to HOME within current traffic	What is my ETA to HOME within current traffic	[IN:GET_ESTIMATED_ARRIVAL What is my ETA to [SL:DESTINATION [IN:GET_LOCATION_HOME HOME ] ] within [SL:DATE_TIME_DEPARTURE current ] traffic ]
Will I arrive to work before 9am on the current route?	Will I arrive to work before 9 am on the current route ?	[IN:GET_ESTIMATED_ARRIVAL Will I arrive to [SL:DESTINATION [IN:GET_LOCATION_WORK work ] ] [SL:DATE_TIME_ARRIVAL before 9 am ] on [SL:PATH the current route ] ? ]
what time arrival if i leave at 6:03pm	what time arrival if i leave at 6 : 03 pm	[IN:GET_ESTIMATED_ARRIVAL what time arrival if i leave [SL:DATE_TIME_DEPARTURE at 6 : 03 pm ] ]
i am starting at 5 PM from school avoiding construction traffic. when will i reach home	i am starting at 5 PM from school avoiding construction traffic . when will i reach home	[IN:GET_ESTIMATED_ARRIVAL i am starting [SL:DATE_TIME_DEPARTURE at 5 PM ] from [SL:SOURCE [IN:GET_LOCATION_SCHOOL school ] ] avoiding [SL:OBSTRUCTION_AVOID construction traffic ] . when will i reach [SL:DESTINATION [IN:GET_LOCATION_HOME home ] ] ]
What time will I get to Joe's house if I leave now?	What time will I get to Joe 's house if I leave now ?	[IN:GET_ESTIMATED_ARRIVAL What time will I get to [SL:DESTINATION [IN:GET_LOCATION_HOME [SL:CONTACT Joe ] 's house ] ] if I leave [SL:DATE_TIME_DEPARTURE now ] ? ]
Can I get to Michelle's house in 40 minutes if I leave here now?	Can I get to Michelle 's house in 40 minutes if I leave here now ?	[IN:GET_ESTIMATED_ARRIVAL Can I get to [SL:DESTINATION [IN:GET_LOCATION_HOME [SL:CONTACT Michelle ] 's house ] ] [SL:DATE_TIME_ARRIVAL in 40 minutes ] if I leave [SL:SOURCE [IN:GET_LOCATION [SL:LOCATION_USER here ] ] ] [SL:DATE_TIME_DEPARTURE now ] ? ]
Church starts at 7 will I make it in time in this traffic	Church starts at 7 will I make it in time in this traffic	[IN:GET_ESTIMATED_ARRIVAL [SL:DESTINATION [IN:GET_EVENT [SL:CATEGORY_EVENT Church ] starts [SL:DATE_TIME at 7 ] ] ] will I make it in time in this traffic ]
if i leave at 10 will i arrive at the airport before 12	if i leave at 10 will i arrive at the airport before 12	[IN:GET_ESTIMATED_ARRIVAL if i leave [SL:DATE_TIME_DEPARTURE at 10 ] will i arrive at [SL:DESTINATION [IN:GET_LOCATION [SL:CATEGORY_LOCATION the airport ] ] ] [SL:DATE_TIME_ARRIVAL before 12 ] ]
Am I going to catch the beginning of the music concert downtown if I move now	Am I going to catch the beginning of the music concert downtown if I move now	[IN:GET_ESTIMATED_ARRIVAL Am I going to catch the beginning of [SL:DESTINATION [IN:GET_EVENT [SL:CATEGORY_EVENT the music concert ] [SL:LOCATION downtown ] ] ] if I move [SL:DATE_TIME_DEPARTURE now ] ]
If i leave my house at 5 am when ill I get to mira's house?	If i leave my house at 5 am when ill I get to mira 's house ?	[IN:GET_ESTIMATED_ARRIVAL If i leave [SL:SOURCE [IN:GET_LOCATION_HOME [SL:CONTACT my ] house ] ] [SL:DATE_TIME_DEPARTURE at 5 am ] when ill I get to [SL:DESTINATION [IN:GET_LOCATION_HOME [SL:CONTACT mira ] 's house ] ] ? ]
If I leave my house around 8AM, what time should I be to Washington DC?	If I leave my house around 8AM , what time should I be to Washington DC ?	[IN:GET_ESTIMATED_ARRIVAL If I leave [SL:SOURCE [IN:GET_LOCATION_HOME [SL:CONTACT my ] house ] ] [SL:DATE_TIME_DEPARTURE around 8AM ] , what time should I be to [SL:DESTINATION Washington DC ] ? ]
If I leave here by 9 pm, will I get to Taipei by 11pm?	If I leave here by 9 pm , will I get to Taipei by 11 pm ?	[IN:GET_ESTIMATED_ARRIVAL If I leave [SL:SOURCE [IN:GET_LOCATION [SL:LOCATION_USER here ] ] ] [SL:DATE_TIME_DEPARTURE by 9 pm ] , will I get to [SL:DESTINATION Taipei ] [SL:DATE_TIME_ARRIVAL by 11 pm ] ? ]
If I leave at 9am will I make it to my first meeting with mohamed in the morning, given the ice and snow on Farland Ave?	If I leave at 9 am will I make it to my first meeting with mohamed in the morning , given the ice and snow on Farland Ave ?	[IN:GET_ESTIMATED_ARRIVAL If I leave [SL:DATE_TIME_DEPARTURE at 9 am ] will I make it to [SL:DESTINATION [IN:GET_EVENT [SL:ORGANIZER_EVENT my ] [SL:ORDINAL first ] [SL:CATEGORY_EVENT meeting ] with [SL:ATTENDEE_EVENT mohamed ] [SL:DATE_TIME in the morning ] ] ] , given [SL:ROAD_CONDITION the ice ] and [SL:ROAD_CONDITION snow ] on Farland Ave ? ]
Do I will be on time at my first meeting if I start driving at 6 AM?	Do I will be on time at my first meeting if I start driving at 6 AM ?	[IN:GET_ESTIMATED_ARRIVAL Do I will be on time at [SL:DESTINATION [IN:GET_EVENT [SL:ATTENDEE_EVENT my ] [SL:ORDINAL first ] [SL:CATEGORY_EVENT meeting ] ] ] if I start [SL:METHOD_TRAVEL driving ] [SL:DATE_TIME_DEPARTURE at 6 AM ] ? ]
Will I have time to ride my bike to Family Video and be there by 4:30?	Will I have time to ride my bike to Family Video and be there by 4 : 30 ?	[IN:GET_ESTIMATED_ARRIVAL Will I have time to ride my [SL:METHOD_TRAVEL bike ] to [SL:DESTINATION [IN:GET_LOCATION [SL:POINT_ON_MAP Family Video ] ] ] and be there [SL:DATE_TIME_ARRIVAL by 4 : 30 ] ? ]
If I leave the VA hospital in biloxi  at 9am and only use 1-10 what time will I arrive at the VA hospital in Pensacola	If I leave the VA hospital in biloxi at 9 am and only use 1 - 10 what time will I arrive at the VA hospital in Pensacola	[IN:GET_ESTIMATED_ARRIVAL If I leave [SL:SOURCE [IN:GET_LOCATION [SL:POINT_ON_MAP the VA hospital ] in [SL:LOCATION_MODIFIER biloxi ] ] ] [SL:DATE_TIME_DEPARTURE at 9 am ] and only use [SL:PATH 1 - 10 ] what time will I arrive at [SL:DESTINATION [IN:GET_LOCATION [SL:POINT_ON_MAP the VA hospital ] in [SL:LOCATION_MODIFIER Pensacola ] ] ] ]
What time will I arrive if I leave right now to reach AT&T Center?	What time will I arrive if I leave right now to reach AT & T Center ?	[IN:GET_ESTIMATED_ARRIVAL What time will I arrive if I leave [SL:DATE_TIME_DEPARTURE right now ] to reach [SL:DESTINATION [IN:GET_LOCATION [SL:POINT_ON_MAP AT & T Center ] ] ] ? ]
what time will i get to atlanta if i left right now	what time will i get to atlanta if i left right now	[IN:GET_ESTIMATED_ARRIVAL what time will i get to [SL:DESTINATION atlanta ] if i left [SL:DATE_TIME_DEPARTURE right now ] ]
Will I get to Jess's house before 10 if I leave now?	Will I get to Jess 's house before 10 if I leave now ?	[IN:GET_ESTIMATED_ARRIVAL Will I get to [SL:DESTINATION [IN:GET_LOCATION_HOME [SL:CONTACT Jess ] 's house ] ] [SL:DATE_TIME_ARRIVAL before 10 ] if I leave [SL:DATE_TIME_DEPARTURE now ] ? ]
What will my arrival time be at Tampa International Airport if I leave at 1 pm from Orlando, FL?	What will my arrival time be at Tampa International Airport if I leave at 1 pm from Orlando , FL ?	[IN:GET_ESTIMATED_ARRIVAL What will my arrival time be at [SL:DESTINATION [IN:GET_LOCATION [SL:POINT_ON_MAP Tampa International Airport ] ] ] if I leave [SL:DATE_TIME_DEPARTURE at 1 pm ] from [SL:SOURCE Orlando , FL ] ? ]
If I leave the house by 8am will I make it to my meeting in time?	If I leave the house by 8 am will I make it to my meeting in time ?	[IN:GET_ESTIMATED_ARRIVAL If I leave [SL:SOURCE [IN:GET_LOCATION_HOME the house ] ] [SL:DATE_TIME_DEPARTURE by 8 am ] will I make it to [SL:DESTINATION [IN:GET_EVENT [SL:ORGANIZER_EVENT my ] [SL:CATEGORY_EVENT meeting ] ] ] in time ? ]
Can I make it Zach's party by 3pm if I leave now?	Can I make it Zach 's party by 3 pm if I leave now ?	[IN:GET_ESTIMATED_ARRIVAL Can I make it [SL:DESTINATION [IN:GET_EVENT [SL:ORGANIZER_EVENT Zach ] 's [SL:CATEGORY_EVENT party ] ] ] [SL:DATE_TIME_ARRIVAL by 3 pm ] if I leave [SL:DATE_TIME_DEPARTURE now ] ? ]
If I take I66, will I make it to my 6pm Zoomba class on time?	If I take I66 , will I make it to my 6 pm Zoomba class on time ?	[IN:GET_ESTIMATED_ARRIVAL If I take [SL:PATH I66 ] , will I make it to [SL:DESTINATION [IN:GET_EVENT [SL:ATTENDEE_EVENT my ] [SL:DATE_TIME 6 pm ] [SL:CATEGORY_EVENT Zoomba class ] ] ] on time ? ]
Can I be in the ceremonial from my office before midnight?	Can I be in the ceremonial from my office before midnight ?	[IN:GET_ESTIMATED_ARRIVAL Can I be in [SL:DESTINATION [IN:GET_EVENT [SL:CATEGORY_EVENT the ceremonial ] ] ] from [SL:SOURCE [IN:GET_LOCATION_WORK [SL:CONTACT my ] office ] ] [SL:DATE_TIME_ARRIVAL before midnight ] ? ]
if i leave now what time will it take me to get to school	if i leave now what time will it take me to get to school	[IN:GET_ESTIMATED_ARRIVAL if i leave [SL:DATE_TIME_DEPARTURE now ] what time will it take me to get to [SL:DESTINATION [IN:GET_LOCATION_SCHOOL school ] ] ]
can i make my 8am meeting if i leave now	can i make my 8 am meeting if i leave now	[IN:GET_ESTIMATED_ARRIVAL can i make [SL:DESTINATION [IN:GET_EVENT [SL:ORGANIZER_EVENT my ] [SL:DATE_TIME 8 am ] [SL:CATEGORY_EVENT meeting ] ] ] if i leave [SL:DATE_TIME_DEPARTURE now ] ]
Is it possible to make it home before 5pm rush hour	Is it possible to make it home before 5 pm rush hour	[IN:GET_ESTIMATED_ARRIVAL Is it possible to make it [SL:DESTINATION [IN:GET_LOCATION_HOME home ] ] [SL:DATE_TIME_ARRIVAL before 5 pm rush hour ] ]
What time will I arrive home	What time will I arrive home	[IN:GET_ESTIMATED_ARRIVAL What time will I arrive [SL:DESTINATION [IN:GET_LOCATION_HOME home ] ] ]
Can I make it to the Quintard Mall in less than 30 minutes if I leave right now?	Can I make it to the Quintard Mall in less than 30 minutes if I leave right now ?	[IN:GET_ESTIMATED_ARRIVAL Can I make it to [SL:DESTINATION [IN:GET_LOCATION [SL:POINT_ON_MAP the Quintard Mall ] ] ] [SL:DATE_TIME_ARRIVAL in less than 30 minutes ] if I leave [SL:DATE_TIME_DEPARTURE right now ] ? ]
when will my husband arrive from work if he leaves now?	when will my husband arrive from work if he leaves now ?	[IN:GET_ESTIMATED_ARRIVAL when will [SL:SOURCE [IN:GET_LOCATION_WORK [SL:CONTACT_RELATED my ] [SL:TYPE_RELATION husband ] arrive from work ] ] if he leaves [SL:DATE_TIME_DEPARTURE now ] ? ]
Can I get from Rebecca's house to Beth's house before noon	Can I get from Rebecca 's house to Beth 's house before noon	[IN:GET_ESTIMATED_ARRIVAL Can I get from [SL:SOURCE [IN:GET_LOCATION_HOME [SL:CONTACT Rebecca ] 's house ] ] to [SL:DESTINATION [IN:GET_LOCATION_HOME [SL:CONTACT Beth ] 's house ] ] [SL:DATE_TIME_ARRIVAL before noon ] ]
The chocolate festival is at the Edison convention center starting at 9 am. If I leave my house now, will I make it on time?	The chocolate festival is at the Edison convention center starting at 9 am . If I leave my house now , will I make it on time ?	[IN:GET_ESTIMATED_ARRIVAL [SL:DESTINATION [IN:GET_EVENT [SL:CATEGORY_EVENT The chocolate festival ] is at [SL:LOCATION [IN:GET_LOCATION [SL:POINT_ON_MAP the Edison convention center ] ] ] starting [SL:DATE_TIME at 9 am ] ] ] . If I leave [SL:SOURCE [IN:GET_LOCATION_HOME [SL:CONTACT my ] house ] ] [SL:DATE_TIME_DEPARTURE now ] , will I make it on time ? ]
Can I get from here to Lafayette, La before noon?	Can I get from here to Lafayette , La before noon ?	[IN:GET_ESTIMATED_ARRIVAL Can I get from [SL:SOURCE [IN:GET_LOCATION [SL:LOCATION_USER here ] ] ] to [SL:DESTINATION Lafayette , La ] [SL:DATE_TIME_ARRIVAL before noon ] ? ]
Can I get from here to Tucson before 8pm?	Can I get from here to Tucson before 8 pm ?	[IN:GET_ESTIMATED_ARRIVAL Can I get from [SL:SOURCE [IN:GET_LOCATION [SL:LOCATION_USER here ] ] ] to [SL:DESTINATION Tucson ] [SL:DATE_TIME_ARRIVAL before 8 pm ] ? ]
Get time arrival to clubhouse in downtown Miami	Get time arrival to clubhouse in downtown Miami	[IN:GET_ESTIMATED_ARRIVAL Get time arrival to [SL:DESTINATION [IN:GET_LOCATION [SL:CATEGORY_LOCATION clubhouse ] in [SL:LOCATION_MODIFIER downtown Miami ] ] ] ]
is it to late to get to fred's house by noon from here	is it to late to get to fred 's house by noon from here	[IN:GET_ESTIMATED_ARRIVAL is it to late to get to [SL:DESTINATION [IN:GET_LOCATION_HOME [SL:CONTACT fred ] 's house ] ] [SL:DATE_TIME_ARRIVAL by noon ] from [SL:SOURCE [IN:GET_LOCATION [SL:LOCATION_USER here ] ] ] ]
If I leave work at 3, what time will I make it to my second job	If I leave work at 3 , what time will I make it to my second job	[IN:GET_ESTIMATED_ARRIVAL If I leave [SL:SOURCE [IN:GET_LOCATION_WORK work ] ] [SL:DATE_TIME_DEPARTURE at 3 ] , what time will I make it to [SL:DESTINATION [IN:GET_LOCATION_WORK [SL:CONTACT my ] second job ] ] ]
If I use Route 50 to get to Lovell, what time will I get there with the current construction?	If I use Route 50 to get to Lovell , what time will I get there with the current construction ?	[IN:GET_ESTIMATED_ARRIVAL If I use [SL:PATH Route 50 ] to get to [SL:DESTINATION Lovell ] , what time will I get there with the current construction ? ]
If I leave here at 7 am, when will I get to Al Dokki square avoiding high ways?	If I leave here at 7 am , when will I get to Al Dokki square avoiding high ways ?	[IN:GET_ESTIMATED_ARRIVAL If I leave [SL:SOURCE [IN:GET_LOCATION [SL:LOCATION_USER here ] ] ] [SL:DATE_TIME_DEPARTURE at 7 am ] , when will I get to [SL:DESTINATION [IN:GET_LOCATION [SL:POINT_ON_MAP Al Dokki square ] ] ] avoiding [SL:PATH_AVOID [IN:GET_LOCATION [SL:CATEGORY_LOCATION high ways ] ] ] ? ]
When will I arrive in Italy if I depart at 6 pm by plane?	When will I arrive in Italy if I depart at 6 pm by plane ?	[IN:GET_ESTIMATED_ARRIVAL When will I arrive in [SL:DESTINATION Italy ] if I depart [SL:DATE_TIME_DEPARTURE at 6 pm ] by [SL:METHOD_TRAVEL plane ] ? ]
Can I get from here to Cairo before dark	Can I get from here to Cairo before dark	[IN:GET_ESTIMATED_ARRIVAL Can I get from [SL:SOURCE [IN:GET_LOCATION [SL:LOCATION_USER here ] ] ] to [SL:DESTINATION Cairo ] [SL:DATE_TIME_ARRIVAL before dark ] ]
i know i can get to cambrige by 5 but can i get from cambrige to forest lake by ten if i leave there at 6	i know i can get to cambrige by 5 but can i get from cambrige to forest lake by ten if i leave there at 6	[IN:GET_ESTIMATED_ARRIVAL i know i can get to [SL:SOURCE cambrige ] by 5 but can i get from cambrige to [SL:DESTINATION forest lake ] [SL:DATE_TIME_ARRIVAL by ten ] if i leave there [SL:DATE_TIME_DEPARTURE at 6 ] ]
what is the projected time to get to Rialto	what is the projected time to get to Rialto	[IN:GET_ESTIMATED_ARRIVAL what is the projected time to get to [SL:DESTINATION Rialto ] ]
Leaving in 5 min will i make it to the concert ontime if i stop to pick up Monica?	Leaving in 5 min will i make it to the concert ontime if i stop to pick up Monica ?	[IN:GET_ESTIMATED_ARRIVAL Leaving [SL:DATE_TIME_DEPARTURE in 5 min ] will i make it to [SL:DESTINATION [IN:GET_EVENT [SL:CATEGORY_EVENT the concert ] ] ] ontime if i stop to pick up [SL:WAYPOINT [IN:GET_LOCATION_HOME [SL:CONTACT Monica ] ] ] ? ]
What time will I get to the DMV if I leave here in 10 minutes?	What time will I get to the DMV if I leave here in 10 minutes ?	[IN:GET_ESTIMATED_ARRIVAL What time will I get to [SL:DESTINATION [IN:GET_LOCATION [SL:POINT_ON_MAP the DMV ] ] ] if I leave [SL:SOURCE [IN:GET_LOCATION [SL:LOCATION_USER here ] ] ] [SL:DATE_TIME_DEPARTURE in 10 minutes ] ? ]
Can I get to Toronto from Rochester by 9am if I leave at 7am?	Can I get to Toronto from Rochester by 9 am if I leave at 7 am ?	[IN:GET_ESTIMATED_ARRIVAL Can I get to [SL:DESTINATION Toronto ] from [SL:SOURCE Rochester ] [SL:DATE_TIME_ARRIVAL by 9 am ] if I leave [SL:DATE_TIME_DEPARTURE at 7 am ] ? ]
Leaving New Orleans at 10am, when will I arrive in Metairie?	Leaving New Orleans at 10 am , when will I arrive in Metairie ?	[IN:GET_ESTIMATED_ARRIVAL Leaving [SL:SOURCE New Orleans ] [SL:DATE_TIME_DEPARTURE at 10 am ] , when will I arrive in [SL:DESTINATION Metairie ] ? ]
What time would I arrive at my parents' house if I leave by 2 pm?	What time would I arrive at my parents ' house if I leave by 2 pm ?	[IN:GET_ESTIMATED_ARRIVAL What time would I arrive at [SL:DESTINATION [IN:GET_LOCATION_HOME [SL:CONTACT_RELATED my ] [SL:TYPE_RELATION parents ] ' house ] ] if I leave [SL:DATE_TIME_DEPARTURE by 2 pm ] ? ]
Will I make it from SFO to the Mission District in less than an hour this afternoon	Will I make it from SFO to the Mission District in less than an hour this afternoon	[IN:GET_ESTIMATED_ARRIVAL Will I make it from [SL:SOURCE [IN:GET_LOCATION [SL:POINT_ON_MAP SFO ] ] ] to [SL:DESTINATION the Mission District ] [SL:DATE_TIME_ARRIVAL in less than an hour ] [SL:DATE_TIME_DEPARTURE this afternoon ] ]
Will I make it to Salem by 4 if I leave at 2?	Will I make it to Salem by 4 if I leave at 2 ?	[IN:GET_ESTIMATED_ARRIVAL Will I make it to [SL:DESTINATION Salem ] [SL:DATE_TIME_ARRIVAL by 4 ] if I leave [SL:DATE_TIME_DEPARTURE at 2 ] ? ]
If I take the I-25, will I arrive at Victoria's before noon?	If I take the I - 25 , will I arrive at Victoria 's before noon ?	[IN:GET_ESTIMATED_ARRIVAL If I take [SL:PATH the I - 25 ] , will I arrive at [SL:DESTINATION [IN:GET_LOCATION_HOME [SL:CONTACT Victoria ] ] ] 's [SL:DATE_TIME_ARRIVAL before noon ] ? ]
Using I10, when will we be in New Orleans?	Using I10 , when will we be in New Orleans ?	[IN:GET_ESTIMATED_ARRIVAL Using [SL:PATH I10 ] , when will we be in [SL:DESTINATION New Orleans ] ? ]
can I get to Sam's club in 25 minutes if I leave now?	can I get to Sam 's club in 25 minutes if I leave now ?	[IN:GET_ESTIMATED_ARRIVAL can I get to [SL:DESTINATION [IN:GET_LOCATION [SL:POINT_ON_MAP Sam 's club ] ] ] [SL:DATE_TIME_ARRIVAL in 25 minutes ] if I leave [SL:DATE_TIME_DEPARTURE now ] ? ]
What time would I arrive at the Baseball Park if I left work at 2 in the afternoon, and took 15 South?	What time would I arrive at the Baseball Park if I left work at 2 in the afternoon , and took 15 South ?	[IN:GET_ESTIMATED_ARRIVAL What time would I arrive at [SL:DESTINATION [IN:GET_LOCATION [SL:CATEGORY_LOCATION the Baseball Park ] ] ] if I left [SL:SOURCE [IN:GET_LOCATION_WORK work ] ] [SL:DATE_TIME_DEPARTURE at 2 in the afternoon ] , and took [SL:PATH 15 South ] ? ]
if i leave geen county at 5 will i get to landerville by 8	if i leave geen county at 5 will i get to landerville by 8	[IN:GET_ESTIMATED_ARRIVAL if i leave [SL:SOURCE geen county ] [SL:DATE_TIME_DEPARTURE at 5 ] will i get to [SL:DESTINATION landerville ] [SL:DATE_TIME_ARRIVAL by 8 ] ]
If I leave my house at 7am will arrive by 10am to Roman's house in Maryland	If I leave my house at 7 am will arrive by 10 am to Roman 's house in Maryland	[IN:GET_ESTIMATED_ARRIVAL If I leave [SL:SOURCE [IN:GET_LOCATION_HOME [SL:CONTACT my ] house ] ] [SL:DATE_TIME_DEPARTURE at 7 am ] will arrive [SL:DATE_TIME_ARRIVAL by 10 am ] to [SL:DESTINATION [IN:GET_LOCATION_HOME [SL:CONTACT Roman ] 's house in [SL:LOCATION [IN:GET_LOCATION [SL:LOCATION_MODIFIER Maryland ] ] ] ] ] ]
can I get to tucson by 11 with the rain?	can I get to tucson by 11 with the rain ?	[IN:GET_ESTIMATED_ARRIVAL can I get to [SL:DESTINATION tucson ] [SL:DATE_TIME_ARRIVAL by 11 ] with [SL:ROAD_CONDITION the rain ] ? ]
Can I get from here to Great mall before 12pm?	Can I get from here to Great mall before 12 pm ?	[IN:GET_ESTIMATED_ARRIVAL Can I get from [SL:SOURCE [IN:GET_LOCATION [SL:LOCATION_USER here ] ] ] to [SL:DESTINATION [IN:GET_LOCATION [SL:POINT_ON_MAP Great mall ] ] ] [SL:DATE_TIME_ARRIVAL before 12 pm ] ? ]
If I leave now, what time would I arrive at school?	If I leave now , what time would I arrive at school ?	[IN:GET_ESTIMATED_ARRIVAL If I leave [SL:DATE_TIME_DEPARTURE now ] , what time would I arrive at [SL:DESTINATION [IN:GET_LOCATION_SCHOOL school ] ] ? ]
If I leave at 7am will I make it to my doctor's appointment  in the morning,	If I leave at 7 am will I make it to my doctor 's appointment in the morning ,	[IN:GET_ESTIMATED_ARRIVAL If I leave [SL:DATE_TIME_DEPARTURE at 7 am ] will I make it to [SL:DESTINATION [IN:GET_EVENT [SL:ATTENDEE_EVENT my ] [SL:CATEGORY_EVENT doctor 's appointment ] [SL:DATE_TIME in the morning ] ] ] , ]
Would I be able to make it to the 6:30pm movie showing if I leave during rush hour from Harry's place?	Would I be able to make it to the 6 : 30 pm movie showing if I leave during rush hour from Harry 's place ?	[IN:GET_ESTIMATED_ARRIVAL Would I be able to make it to [SL:DESTINATION [IN:GET_EVENT the [SL:DATE_TIME 6 : 30 pm ] [SL:CATEGORY_EVENT movie showing ] ] ] if I leave [SL:DATE_TIME_DEPARTURE during rush hour ] from [SL:SOURCE [IN:GET_LOCATION_HOME [SL:CONTACT Harry ] 's place ] ] ? ]
What time will I arrive if i leave after 1 hour	What time will I arrive if i leave after 1 hour	[IN:GET_ESTIMATED_ARRIVAL What time will I arrive if i leave [SL:DATE_TIME_DEPARTURE after 1 hour ] ]
what's the approximate time of arrival to destination	what 's the approximate time of arrival to destination	[IN:GET_ESTIMATED_ARRIVAL what 's the approximate time of arrival to [SL:DESTINATION destination ] ]
Can I get to Cleveland by 4:00 with the current traffic conditions?	Can I get to Cleveland by 4 : 00 with the current traffic conditions ?	[IN:GET_ESTIMATED_ARRIVAL Can I get to [SL:DESTINATION Cleveland ] [SL:DATE_TIME_ARRIVAL by 4 : 00 ] with the current traffic conditions ? ]
If i take the broken arrow expressway from here, can i arrive to Tamara's by 7?	If i take the broken arrow expressway from here , can i arrive to Tamara 's by 7 ?	[IN:GET_ESTIMATED_ARRIVAL If i take [SL:PATH the broken arrow expressway ] from [SL:SOURCE [IN:GET_LOCATION [SL:LOCATION_USER here ] ] ] , can i arrive to [SL:DESTINATION [IN:GET_LOCATION_HOME [SL:CONTACT Tamara ] ] ] 's [SL:DATE_TIME_ARRIVAL by 7 ] ? ]
what time will i arrive at my destination	what time will i arrive at my destination	[IN:GET_ESTIMATED_ARRIVAL what time will i arrive at [SL:DESTINATION my destination ] ]
Can I get to Denver by 8:00 with the current traffic conditions?	Can I get to Denver by 8 : 00 with the current traffic conditions ?	[IN:GET_ESTIMATED_ARRIVAL Can I get to [SL:DESTINATION Denver ] [SL:DATE_TIME_ARRIVAL by 8 : 00 ] with the current traffic conditions ? ]
If I leave Alexandria by the car, when will I get to Desok?	If I leave Alexandria by the car , when will I get to Desok ?	[IN:GET_ESTIMATED_ARRIVAL If I leave [SL:SOURCE Alexandria ] by the [SL:METHOD_TRAVEL car ] , when will I get to [SL:DESTINATION Desok ] ? ]
If I take the 11 Hwy can I make it to Yuma by 4 pm	If I take the 11 Hwy can I make it to Yuma by 4 pm	[IN:GET_ESTIMATED_ARRIVAL If I take [SL:PATH the 11 Hwy ] can I make it to [SL:DESTINATION Yuma ] [SL:DATE_TIME_ARRIVAL by 4 pm ] ]
WHAT TIME AND DAY WILL I ARRIVE IN CALIFORNIA IF I LEAVE NEW YORK AT MIDNIGHT TONIGHT	WHAT TIME AND DAY WILL I ARRIVE IN CALIFORNIA IF I LEAVE NEW YORK AT MIDNIGHT TONIGHT	[IN:GET_ESTIMATED_ARRIVAL WHAT TIME AND DAY WILL I ARRIVE IN [SL:DESTINATION CALIFORNIA ] IF I LEAVE [SL:SOURCE NEW YORK ] [SL:DATE_TIME_DEPARTURE AT MIDNIGHT TONIGHT ] ]
If I left right now, what time will I make it to FedEx Forum	If I left right now , what time will I make it to FedEx Forum	[IN:GET_ESTIMATED_ARRIVAL If I left [SL:DATE_TIME_DEPARTURE right now ] , what time will I make it to [SL:DESTINATION [IN:GET_LOCATION [SL:POINT_ON_MAP FedEx Forum ] ] ] ]
Can I get Cairo university by 5 Pm starting driving from my daughter's house.	Can I get Cairo university by 5 Pm starting driving from my daughter 's house .	[IN:GET_ESTIMATED_ARRIVAL Can I get [SL:DESTINATION [IN:GET_LOCATION [SL:POINT_ON_MAP Cairo university ] ] ] [SL:DATE_TIME_ARRIVAL by 5 Pm ] starting [SL:METHOD_TRAVEL driving ] from [SL:SOURCE [IN:GET_LOCATION_HOME [SL:CONTACT_RELATED my ] [SL:TYPE_RELATION daughter ] 's house ] ] . ]
can i get from home to elijay in 2 hours	can i get from home to elijay in 2 hours	[IN:GET_ESTIMATED_ARRIVAL can i get from [SL:SOURCE [IN:GET_LOCATION_HOME home ] ] to [SL:DESTINATION elijay ] [SL:DATE_TIME_ARRIVAL in 2 hours ] ]
What time will I arrive	What time will I arrive	[IN:GET_ESTIMATED_ARRIVAL What time will I arrive ]
If I leave here right now what time well I reach the Bourne Bridge	If I leave here right now what time well I reach the Bourne Bridge	[IN:GET_ESTIMATED_ARRIVAL If I leave [SL:SOURCE [IN:GET_LOCATION [SL:LOCATION_USER here ] ] ] [SL:DATE_TIME_DEPARTURE right now ] what time well I reach [SL:DESTINATION [IN:GET_LOCATION [SL:POINT_ON_MAP the Bourne Bridge ] ] ] ]
Do you think I can make it to Boston before 1 PM today?	Do you think I can make it to Boston before 1 PM today ?	[IN:GET_ESTIMATED_ARRIVAL Do you think I can make it to [SL:DESTINATION Boston ] [SL:DATE_TIME_ARRIVAL before 1 PM today ] ? ]
