Will I make it to the meeting at 7 p.m. in Eastpointe if I leave now?	Will I make it to the meeting at 7 p.m . in Eastpointe if I leave now ?	[IN:GET_ESTIMATED_ARRIVAL Will I make it to [SL:DESTINATION [IN:GET_EVENT [SL:CATEGORY_EVENT the meeting ] [SL:DATE_TIME at 7 p.m . ] in [SL:LOCATION Eastpointe ] ] ] if I leave [SL:DATE_TIME_DEPARTURE now ] ? ]
Is it realistic to make it to Benton Harbor by 5?	Is it realistic to make it to Benton Harbor by 5 ?	[IN:GET_ESTIMATED_ARRIVAL Is it realistic to make it to [SL:DESTINATION Benton Harbor ] [SL:DATE_TIME_ARRIVAL by 5 ] ? ]
If i leave at 11:30 will i make it to my lunch appointment downtown?	If i leave at 11 : 30 will i make it to my lunch appointment downtown ?	[IN:GET_ESTIMATED_ARRIVAL If i leave [SL:DATE_TIME_DEPARTURE at 11 : 30 ] will i make it to [SL:DESTINATION [IN:GET_EVENT [SL:ORGANIZER_EVENT my ] [SL:CATEGORY_EVENT lunch appointment ] [SL:LOCATION downtown ] ] ] ? ]
if I leave my house at 5 a.m., what time will i get to greensboro	if I leave my house at 5 a.m . , what time will i get to greensboro	[IN:GET_ESTIMATED_ARRIVAL if I leave [SL:SOURCE [IN:GET_LOCATION_HOME [SL:CONTACT my ] house ] ] [SL:DATE_TIME_DEPARTURE at 5 a.m ] . , what time will i get to [SL:DESTINATION greensboro ] ]
If we leave Jacks house at 7 what time will get get to Dads new place?	If we leave Jacks house at 7 what time will get get to Dads new place ?	[IN:GET_ESTIMATED_ARRIVAL If we leave [SL:SOURCE [IN:GET_LOCATION_HOME [SL:CONTACT Jacks ] house ] ] [SL:DATE_TIME_DEPARTURE at 7 ] what time will get get to [SL:DESTINATION [IN:GET_LOCATION_HOME [SL:TYPE_RELATION Dads ] new place ] ] ? ]
When will I get to Bandung if I leave Kalibata city at 2 am?	When will I get to Bandung if I leave Kalibata city at 2 am ?	[IN:GET_ESTIMATED_ARRIVAL When will I get to [SL:DESTINATION Bandung ] if I leave [SL:SOURCE Kalibata city ] [SL:DATE_TIME_DEPARTURE at 2 am ] ? ]
Will I get to my spa appointment by 3pm if I leave in 10 minutes?	Will I get to my spa appointment by 3 pm if I leave in 10 minutes ?	[IN:GET_ESTIMATED_ARRIVAL Will I get to [SL:DESTINATION [IN:GET_EVENT [SL:ATTENDEE_EVENT my ] [SL:CATEGORY_EVENT spa appointment ] ] ] [SL:DATE_TIME_ARRIVAL by 3 pm ] if I leave [SL:DATE_TIME_DEPARTURE in 10 minutes ] ? ]
If I leave for Illinois at 11 AM from Flint, what time should I be arriving?	If I leave for Illinois at 11 AM from Flint , what time should I be arriving ?	[IN:GET_ESTIMATED_ARRIVAL If I leave for [SL:DESTINATION Illinois ] [SL:DATE_TIME_DEPARTURE at 11 AM ] from [SL:SOURCE Flint ] , what time should I be arriving ? ]
can i get to my meeting by 5 from where i am at now	can i get to my meeting by 5 from where i am at now	[IN:GET_ESTIMATED_ARRIVAL can [SL:SOURCE [IN:GET_LOCATION [SL:LOCATION_USER i ] ] ] get to [SL:DESTINATION [IN:GET_EVENT [SL:ORGANIZER_EVENT my ] [SL:CATEGORY_EVENT meeting ] ] ] [SL:DATE_TIME_ARRIVAL by 5 ] from where i am at [SL:DATE_TIME_DEPARTURE now ] ]
If I leave in 20 minutes  will I make my 2pm appointment?	If I leave in 20 minutes will I make my 2 pm appointment ?	[IN:GET_ESTIMATED_ARRIVAL If I leave [SL:DATE_TIME_DEPARTURE in 20 minutes ] will I make [SL:DESTINATION [IN:GET_EVENT [SL:ORGANIZER_EVENT my ] [SL:DATE_TIME 2 pm ] [SL:CATEGORY_EVENT appointment ] ] ] ? ]
what will be my estimated arrival time at Whole Foods on Old Milton Road if I start out at 4 PM today?	what will be my estimated arrival time at Whole Foods on Old Milton Road if I start out at 4 PM today ?	[IN:GET_ESTIMATED_ARRIVAL what will be my estimated arrival time at [SL:DESTINATION [IN:GET_LOCATION [SL:POINT_ON_MAP Whole Foods ] on [SL:LOCATION_MODIFIER Old Milton Road ] ] ] if I start out [SL:DATE_TIME_DEPARTURE at 4 PM today ] ? ]
Can I make it to the gym by 6 pm if I leave in 10 minutes	Can I make it to the gym by 6 pm if I leave in 10 minutes	[IN:GET_ESTIMATED_ARRIVAL Can I make it to [SL:DESTINATION [IN:GET_LOCATION [SL:CATEGORY_LOCATION the gym ] ] ] [SL:DATE_TIME_ARRIVAL by 6 pm ] if I leave [SL:DATE_TIME_DEPARTURE in 10 minutes ] ]
Will I get to Emilio's birthday before noon?	Will I get to Emilio 's birthday before noon ?	[IN:GET_ESTIMATED_ARRIVAL Will I get to [SL:DESTINATION [IN:GET_EVENT [SL:ORGANIZER_EVENT Emilio ] 's [SL:CATEGORY_EVENT birthday ] ] ] [SL:DATE_TIME_ARRIVAL before noon ] ? ]
If I leave North Carolina now, will I arrive to my appointment this afternoon?	If I leave North Carolina now , will I arrive to my appointment this afternoon ?	[IN:GET_ESTIMATED_ARRIVAL If I leave [SL:SOURCE North Carolina ] [SL:DATE_TIME_DEPARTURE now ] , will I arrive to [SL:DESTINATION [IN:GET_EVENT [SL:ORGANIZER_EVENT my ] [SL:CATEGORY_EVENT appointment ] [SL:DATE_TIME this afternoon ] ] ] ? ]
My meeting is at 6. if I leave now can I make it on time	My meeting is at 6 . if I leave now can I make it on time	[IN:GET_ESTIMATED_ARRIVAL [SL:DESTINATION [IN:GET_EVENT [SL:ORGANIZER_EVENT My ] [SL:CATEGORY_EVENT meeting ] is [SL:DATE_TIME at 6 ] ] ] . if I leave [SL:DATE_TIME_DEPARTURE now ] can I make it on time ]
If I take Highway 9 to Purcell will I be there by 9pm?	If I take Highway 9 to Purcell will I be there by 9 pm ?	[IN:GET_ESTIMATED_ARRIVAL If I take [SL:PATH Highway 9 ] to [SL:DESTINATION Purcell ] will I be there [SL:DATE_TIME_ARRIVAL by 9 pm ] ? ]
Will I make in time to the movies if I leave right now	Will I make in time to the movies if I leave right now	[IN:GET_ESTIMATED_ARRIVAL Will I make in time to [SL:DESTINATION [IN:GET_EVENT [SL:CATEGORY_EVENT the movies ] ] ] if I leave [SL:DATE_TIME_DEPARTURE right now ] ]
when will i get to gregs	when will i get to gregs	[IN:GET_ESTIMATED_ARRIVAL when will i get to [SL:DESTINATION [IN:GET_LOCATION_HOME [SL:CONTACT gregs ] ] ] ]
Can I get from here to Campinas city before 9pm using freeways?	Can I get from here to Campinas city before 9 pm using freeways ?	[IN:GET_ESTIMATED_ARRIVAL Can I get from [SL:SOURCE [IN:GET_LOCATION [SL:LOCATION_USER here ] ] ] to [SL:DESTINATION Campinas city ] [SL:DATE_TIME_ARRIVAL before 9 pm ] using [SL:PATH [IN:GET_LOCATION [SL:CATEGORY_LOCATION freeways ] ] ] ? ]
Are we going to get there later from traffic	Are we going to get there later from traffic	[IN:GET_ESTIMATED_ARRIVAL Are we going to get there later from traffic ]
what time will i reach alexandria train station if i leave cairo train station at 7 AM?	what time will i reach alexandria train station if i leave cairo train station at 7 AM ?	[IN:GET_ESTIMATED_ARRIVAL what time will i reach [SL:DESTINATION [IN:GET_LOCATION [SL:POINT_ON_MAP alexandria train station ] ] ] if i leave [SL:SOURCE [IN:GET_LOCATION [SL:POINT_ON_MAP cairo train station ] ] ] [SL:DATE_TIME_DEPARTURE at 7 AM ] ? ]
When will I get to the Renn Faire if I leave in 20 minutes?	When will I get to the Renn Faire if I leave in 20 minutes ?	[IN:GET_ESTIMATED_ARRIVAL When will I get to [SL:DESTINATION [IN:GET_EVENT [SL:CATEGORY_EVENT the Renn Faire ] ] ] if I leave [SL:DATE_TIME_DEPARTURE in 20 minutes ] ? ]
If I leave right now, when will I get to GA	If I leave right now , when will I get to GA	[IN:GET_ESTIMATED_ARRIVAL If I leave [SL:DATE_TIME_DEPARTURE right now ] , when will I get to [SL:DESTINATION GA ] ]
I am leaving now for my dental appointment, so what time will I arrive?	I am leaving now for my dental appointment , so what time will I arrive ?	[IN:GET_ESTIMATED_ARRIVAL I am leaving [SL:DATE_TIME_DEPARTURE now ] for [SL:DESTINATION [IN:GET_EVENT [SL:ORGANIZER_EVENT my ] [SL:CATEGORY_EVENT dental appointment ] ] ] , so what time will I arrive ? ]
If I leave the Hall and Oats concert at 9:00lm, what time will I get home?	If I leave the Hall and Oats concert at 9 : 00lm , what time will I get home ?	[IN:GET_ESTIMATED_ARRIVAL If I leave [SL:SOURCE [IN:GET_EVENT the [SL:NAME_EVENT Hall and Oats ] [SL:CATEGORY_EVENT concert ] ] ] [SL:DATE_TIME_DEPARTURE at 9 : 00lm ] , what time will I get [SL:DESTINATION [IN:GET_LOCATION_HOME home ] ] ? ]
If I leave now, what time would I get to Ashley's house?	If I leave now , what time would I get to Ashley 's house ?	[IN:GET_ESTIMATED_ARRIVAL If I leave [SL:DATE_TIME_DEPARTURE now ] , what time would I get to [SL:DESTINATION [IN:GET_LOCATION_HOME [SL:CONTACT Ashley ] 's house ] ] ? ]
Can I get from my current location to New York before noon	Can I get from my current location to New York before noon	[IN:GET_ESTIMATED_ARRIVAL Can I get from [SL:SOURCE [IN:GET_LOCATION [SL:LOCATION_USER my current location ] ] ] to [SL:DESTINATION New York ] [SL:DATE_TIME_ARRIVAL before noon ] ]
Will I make it to my girlfriend's by 5 pm?	Will I make it to my girlfriend 's by 5 pm ?	[IN:GET_ESTIMATED_ARRIVAL Will I make it to [SL:DESTINATION [IN:GET_LOCATION_HOME [SL:CONTACT_RELATED my ] [SL:TYPE_RELATION girlfriend ] ] ] 's [SL:DATE_TIME_ARRIVAL by 5 pm ] ? ]
when will i arrive at home if i leave work at 5 pm?	when will i arrive at home if i leave work at 5 pm ?	[IN:GET_ESTIMATED_ARRIVAL when will i arrive at [SL:DESTINATION [IN:GET_LOCATION_HOME home ] ] if i leave [SL:SOURCE [IN:GET_LOCATION_WORK work ] ] [SL:DATE_TIME_DEPARTURE at 5 pm ] ? ]
will the bus get me to downtown by 5:30 am on sunday?	will the bus get me to downtown by 5 : 30 am on sunday ?	[IN:GET_ESTIMATED_ARRIVAL will the [SL:METHOD_TRAVEL bus ] get me to [SL:DESTINATION downtown ] [SL:DATE_TIME_ARRIVAL by 5 : 30 am on sunday ] ? ]
Will I make it to the San Jose Airport by noon if I leave at 11am?	Will I make it to the San Jose Airport by noon if I leave at 11 am ?	[IN:GET_ESTIMATED_ARRIVAL Will I make it to [SL:DESTINATION [IN:GET_LOCATION [SL:POINT_ON_MAP the San Jose Airport ] ] ] [SL:DATE_TIME_ARRIVAL by noon ] if I leave [SL:DATE_TIME_DEPARTURE at 11 am ] ? ]
am I late to work at this traffic	am I late to work at this traffic	[IN:GET_ESTIMATED_ARRIVAL am I late to [SL:DESTINATION [IN:GET_LOCATION_WORK work ] ] at this traffic ]
If I leave at 8pm will I make it to the movie that starts at 8:45pm given the construction on 104th & Sheridan?	If I leave at 8 pm will I make it to the movie that starts at 8 : 45 pm given the construction on 104th & Sheridan ?	[IN:GET_ESTIMATED_ARRIVAL If I leave [SL:DATE_TIME_DEPARTURE at 8 pm ] will I make it to [SL:DESTINATION [IN:GET_EVENT [SL:CATEGORY_EVENT the movie ] that starts [SL:DATE_TIME at 8 : 45 pm ] ] ] given the construction on 104th & Sheridan ? ]
What would my arrival time in Lewisburg, TN be if I left now and avoided the interstate	What would my arrival time in Lewisburg , TN be if I left now and avoided the interstate	[IN:GET_ESTIMATED_ARRIVAL What would my arrival time in [SL:DESTINATION Lewisburg , TN ] be if I left [SL:DATE_TIME_DEPARTURE now ] and avoided [SL:PATH_AVOID the interstate ] ]
Can I get from here to San Jose Japan town before noon?	Can I get from here to San Jose Japan town before noon ?	[IN:GET_ESTIMATED_ARRIVAL Can I get from [SL:SOURCE [IN:GET_LOCATION [SL:LOCATION_USER here ] ] ] to [SL:DESTINATION San Jose Japan town ] [SL:DATE_TIME_ARRIVAL before noon ] ? ]
If I leave by 3pm will I get to the wedding at 5pm with the snow?	If I leave by 3 pm will I get to the wedding at 5 pm with the snow ?	[IN:GET_ESTIMATED_ARRIVAL If I leave [SL:DATE_TIME_DEPARTURE by 3 pm ] will I get to [SL:DESTINATION [IN:GET_EVENT [SL:CATEGORY_EVENT the wedding ] [SL:DATE_TIME at 5 pm ] ] ] with [SL:ROAD_CONDITION the snow ] ? ]
I'm leaving now, what time will I be a Karin's house?	I'm leaving now , what time will I be a Karin 's house ?	[IN:GET_ESTIMATED_ARRIVAL I'm leaving [SL:DATE_TIME_DEPARTURE now ] , what time will I be a [SL:DESTINATION [IN:GET_LOCATION_HOME [SL:CONTACT Karin ] 's house ] ] ? ]
when will I arrive to san diego port by train if I leave now	when will I arrive to san diego port by train if I leave now	[IN:GET_ESTIMATED_ARRIVAL when will I arrive to [SL:DESTINATION [IN:GET_LOCATION [SL:POINT_ON_MAP san diego port ] ] ] by [SL:METHOD_TRAVEL train ] if I leave [SL:DATE_TIME_DEPARTURE now ] ]
when will i arrive to Haram metro station if i leave my office at 2 pm by bike	when will i arrive to Haram metro station if i leave my office at 2 pm by bike	[IN:GET_ESTIMATED_ARRIVAL when will i arrive to [SL:DESTINATION [IN:GET_LOCATION [SL:POINT_ON_MAP Haram metro station ] ] ] if i leave [SL:SOURCE [IN:GET_LOCATION_WORK [SL:CONTACT my ] office ] ] [SL:DATE_TIME_DEPARTURE at 2 pm ] by [SL:METHOD_TRAVEL bike ] ]
Can I get from here to Nutley by 7?	Can I get from here to Nutley by 7 ?	[IN:GET_ESTIMATED_ARRIVAL Can I get from [SL:SOURCE here ] to [SL:DESTINATION Nutley ] [SL:DATE_TIME_ARRIVAL by 7 ] ? ]
If I leave this hotel at 7 AM will I be able to make the conference center by nine	If I leave this hotel at 7 AM will I be able to make the conference center by nine	[IN:GET_ESTIMATED_ARRIVAL If I leave [SL:SOURCE [IN:GET_LOCATION [SL:CATEGORY_LOCATION this hotel ] ] ] [SL:DATE_TIME_DEPARTURE at 7 AM ] will I be able to make [SL:DESTINATION [IN:GET_LOCATION [SL:CATEGORY_LOCATION the conference center ] ] ] [SL:DATE_TIME_ARRIVAL by nine ] ]
Can I get from here to Irondequoit before noon?	Can I get from here to Irondequoit before noon ?	[IN:GET_ESTIMATED_ARRIVAL Can I get from [SL:SOURCE [IN:GET_LOCATION [SL:LOCATION_USER here ] ] ] to [SL:DESTINATION Irondequoit ] [SL:DATE_TIME_ARRIVAL before noon ] ? ]
can I get to dinner from here before 6 in this traffic or not?	can I get to dinner from here before 6 in this traffic or not ?	[IN:GET_ESTIMATED_ARRIVAL can I get to [SL:DESTINATION [IN:GET_EVENT [SL:CATEGORY_EVENT dinner ] ] ] from [SL:SOURCE [IN:GET_LOCATION [SL:LOCATION_USER here ] ] ] [SL:DATE_TIME_ARRIVAL before 6 ] in this traffic or not ? ]
Will all of the rain will I make it to Denver by morning?	Will all of the rain will I make it to Denver by morning ?	[IN:GET_ESTIMATED_ARRIVAL Will all of [SL:ROAD_CONDITION the rain ] will I make it to [SL:DESTINATION Denver ] [SL:DATE_TIME_ARRIVAL by morning ] ? ]
If I take this two day trip, will I make it to my brother's house by Thursday morning?	If I take this two day trip , will I make it to my brother 's house by Thursday morning ?	[IN:GET_ESTIMATED_ARRIVAL If I take this two day trip , will I make it to [SL:DESTINATION [IN:GET_LOCATION_HOME [SL:CONTACT_RELATED my ] [SL:TYPE_RELATION brother ] 's house ] ] [SL:DATE_TIME_ARRIVAL by Thursday morning ] ? ]
Can I get from here to Atlanta before 3am?	Can I get from here to Atlanta before 3 am ?	[IN:GET_ESTIMATED_ARRIVAL Can I get from [SL:SOURCE [IN:GET_LOCATION [SL:LOCATION_USER here ] ] ] to [SL:DESTINATION Atlanta ] [SL:DATE_TIME_ARRIVAL before 3 am ] ? ]
if i leave now what time will it take for me to get home from school	if i leave now what time will it take for me to get home from school	[IN:GET_ESTIMATED_ARRIVAL if i leave [SL:DATE_TIME_DEPARTURE now ] what time will it take for me to get [SL:DESTINATION [IN:GET_LOCATION_HOME home ] ] from [SL:SOURCE [IN:GET_LOCATION_SCHOOL school ] ] ]
What time will I arrive at my doctor's office, if I leave my house in 20 minutes?	What time will I arrive at my doctor 's office , if I leave my house in 20 minutes ?	[IN:GET_ESTIMATED_ARRIVAL What time will I arrive at [SL:DESTINATION [IN:GET_LOCATION [SL:CATEGORY_LOCATION my doctor 's office ] ] ] , if I leave [SL:SOURCE [IN:GET_LOCATION_HOME [SL:CONTACT my ] house ] ] [SL:DATE_TIME_DEPARTURE in 20 minutes ] ? ]
Using I35 will I be to Mom's by 7?	Using I35 will I be to Mom 's by 7 ?	[IN:GET_ESTIMATED_ARRIVAL Using [SL:PATH I35 ] will I be to [SL:DESTINATION [IN:GET_LOCATION_HOME [SL:TYPE_RELATION Mom ] ] ] 's [SL:DATE_TIME_ARRIVAL by 7 ] ? ]
what is the expected arrival time for me if started from home at 2pm for my daughter's 3pm lesson.	what is the expected arrival time for me if started from home at 2 pm for my daughter 's 3 pm lesson .	[IN:GET_ESTIMATED_ARRIVAL what is the expected arrival time for me if started from [SL:SOURCE [IN:GET_LOCATION_HOME home ] ] [SL:DATE_TIME_DEPARTURE at 2 pm ] for [SL:DESTINATION [IN:GET_EVENT [SL:ORGANIZER_EVENT [IN:GET_CONTACT [SL:CONTACT_RELATED my ] [SL:TYPE_RELATION daughter ] ] ] 's [SL:DATE_TIME 3 pm ] [SL:CATEGORY_EVENT lesson ] ] ] . ]
What time should I arrive to work today	What time should I arrive to work today	[IN:GET_ESTIMATED_ARRIVAL What time should I arrive to [SL:DESTINATION [IN:GET_LOCATION_WORK work ] ] [SL:DATE_TIME_ARRIVAL today ] ]
If I leave now, will I make it by 6pm to the Anime Convention by taking 4th Ave?	If I leave now , will I make it by 6 pm to the Anime Convention by taking 4th Ave ?	[IN:GET_ESTIMATED_ARRIVAL If I leave [SL:DATE_TIME_DEPARTURE now ] , will I make it [SL:DATE_TIME_ARRIVAL by 6 pm ] to [SL:DESTINATION [IN:GET_EVENT [SL:CATEGORY_EVENT the Anime Convention ] ] ] by taking [SL:PATH 4th Ave ] ? ]
Can I make it to the airport in an hour?	Can I make it to the airport in an hour ?	[IN:GET_ESTIMATED_ARRIVAL Can I make it to [SL:DESTINATION [IN:GET_LOCATION [SL:CATEGORY_LOCATION the airport ] ] ] [SL:DATE_TIME_ARRIVAL in an hour ] ? ]
Will I be able to make it to the doctor's in 30 minutes?	Will I be able to make it to the doctor 's in 30 minutes ?	[IN:GET_ESTIMATED_ARRIVAL Will I be able to make it to [SL:DESTINATION [IN:GET_LOCATION [SL:CATEGORY_LOCATION the doctor ] ] ] 's [SL:DATE_TIME_ARRIVAL in 30 minutes ] ? ]
can I get home before 3pm	can I get home before 3 pm	[IN:GET_ESTIMATED_ARRIVAL can I get [SL:DESTINATION [IN:GET_LOCATION_HOME home ] ] [SL:DATE_TIME_ARRIVAL before 3 pm ] ]
Can I reach Lulu hypermarket by 2 pm if I leave now?	Can I reach Lulu hypermarket by 2 pm if I leave now ?	[IN:GET_ESTIMATED_ARRIVAL Can I reach [SL:DESTINATION [IN:GET_LOCATION [SL:POINT_ON_MAP Lulu hypermarket ] ] ] [SL:DATE_TIME_ARRIVAL by 2 pm ] if I leave [SL:DATE_TIME_DEPARTURE now ] ? ]
I'm leaving for the mall at 4, what time will I arrive?	I'm leaving for the mall at 4 , what time will I arrive ?	[IN:GET_ESTIMATED_ARRIVAL I'm leaving for [SL:DESTINATION [IN:GET_LOCATION [SL:CATEGORY_LOCATION the mall ] ] ] [SL:DATE_TIME_DEPARTURE at 4 ] , what time will I arrive ? ]
can I arrive long beach port before sunset	can I arrive long beach port before sunset	[IN:GET_ESTIMATED_ARRIVAL can I arrive [SL:DESTINATION [IN:GET_LOCATION [SL:POINT_ON_MAP long beach port ] ] ] [SL:DATE_TIME_ARRIVAL before sunset ] ]
What time will I get home if I use the fastest route	What time will I get home if I use the fastest route	[IN:GET_ESTIMATED_ARRIVAL What time will I get [SL:DESTINATION [IN:GET_LOCATION_HOME home ] ] if I use the fastest route ]
What time should I arrive to Houston if I leave 9am tomorrow morning?	What time should I arrive to Houston if I leave 9 am tomorrow morning ?	[IN:GET_ESTIMATED_ARRIVAL What time should I arrive to [SL:DESTINATION Houston ] if I leave [SL:DATE_TIME_DEPARTURE 9 am tomorrow morning ] ? ]
Will I make it home quickly	Will I make it home quickly	[IN:GET_ESTIMATED_ARRIVAL Will I make it [SL:DESTINATION [IN:GET_LOCATION_HOME home ] ] quickly ]
What time will I arrive at the stadium if I leave here at 3 pm?	What time will I arrive at the stadium if I leave here at 3 pm ?	[IN:GET_ESTIMATED_ARRIVAL What time will I arrive at [SL:DESTINATION [IN:GET_LOCATION [SL:CATEGORY_LOCATION the stadium ] ] ] if I leave [SL:SOURCE [IN:GET_LOCATION [SL:LOCATION_USER here ] ] ] [SL:DATE_TIME_DEPARTURE at 3 pm ] ? ]
Will I make it to work by 10 AM if I left right now?	Will I make it to work by 10 AM if I left right now ?	[IN:GET_ESTIMATED_ARRIVAL Will I make it to [SL:DESTINATION [IN:GET_LOCATION_WORK work ] ] [SL:DATE_TIME_ARRIVAL by 10 AM ] if I left [SL:DATE_TIME_DEPARTURE right now ] ? ]
Can I get to Conni's by midnight with current conditions	Can I get to Conni 's by midnight with current conditions	[IN:GET_ESTIMATED_ARRIVAL Can I get to [SL:DESTINATION [IN:GET_LOCATION_HOME [SL:CONTACT Conni ] ] ] 's [SL:DATE_TIME_ARRIVAL by midnight ] with current conditions ]
What time will i get to Clearwater if I leave my house now?	What time will i get to Clearwater if I leave my house now ?	[IN:GET_ESTIMATED_ARRIVAL What time will i get to [SL:DESTINATION Clearwater ] if I leave [SL:SOURCE [IN:GET_LOCATION_HOME [SL:CONTACT my ] house ] ] [SL:DATE_TIME_DEPARTURE now ] ? ]
If I leave work by 5pm, what time will I arrive in JFK?	If I leave work by 5 pm , what time will I arrive in JFK ?	[IN:GET_ESTIMATED_ARRIVAL If I leave [SL:SOURCE [IN:GET_LOCATION_WORK work ] ] [SL:DATE_TIME_DEPARTURE by 5 pm ] , what time will I arrive in [SL:DESTINATION [IN:GET_LOCATION [SL:POINT_ON_MAP JFK ] ] ] ? ]
Can I make it to my doctors appointment in Athens if I leave in 10 minutes?	Can I make it to my doctors appointment in Athens if I leave in 10 minutes ?	[IN:GET_ESTIMATED_ARRIVAL Can I make it to [SL:DESTINATION [IN:GET_EVENT [SL:ATTENDEE_EVENT my ] [SL:CATEGORY_EVENT doctors appointment ] in [SL:LOCATION Athens ] ] ] if I leave [SL:DATE_TIME_DEPARTURE in 10 minutes ] ? ]
Can I get from here to Pensacola before noon?	Can I get from here to Pensacola before noon ?	[IN:GET_ESTIMATED_ARRIVAL Can I get from [SL:SOURCE [IN:GET_LOCATION [SL:LOCATION_USER here ] ] ] to [SL:DESTINATION Pensacola ] [SL:DATE_TIME_ARRIVAL before noon ] ? ]
Can I get to Conyers by 6pm with current traffic conditions.	Can I get to Conyers by 6 pm with current traffic conditions .	[IN:GET_ESTIMATED_ARRIVAL Can I get to [SL:DESTINATION Conyers ] [SL:DATE_TIME_ARRIVAL by 6 pm ] with current traffic conditions . ]
am i going to get to school on time	am i going to get to school on time	[IN:GET_ESTIMATED_ARRIVAL am i going to get to [SL:DESTINATION [IN:GET_LOCATION_SCHOOL school ] ] on time ]
What time would i arrive in Ft Lauderdale if I left the house now?	What time would i arrive in Ft Lauderdale if I left the house now ?	[IN:GET_ESTIMATED_ARRIVAL What time would i arrive in [SL:DESTINATION Ft Lauderdale ] if I left [SL:SOURCE [IN:GET_LOCATION_HOME the house ] ] [SL:DATE_TIME_DEPARTURE now ] ? ]
what time will I make it to my 5 pm meeting if I travel interstate 75	what time will I make it to my 5 pm meeting if I travel interstate 75	[IN:GET_ESTIMATED_ARRIVAL what time will I make it to [SL:DESTINATION [IN:GET_EVENT [SL:ORGANIZER_EVENT my ] [SL:DATE_TIME 5 pm ] [SL:CATEGORY_EVENT meeting ] ] ] if I travel [SL:PATH interstate 75 ] ]
In this traffic, what is my estimated time of arrival home	In this traffic , what is my estimated time of arrival home	[IN:GET_ESTIMATED_ARRIVAL In this traffic , what is my estimated time of arrival [SL:DESTINATION [IN:GET_LOCATION_HOME home ] ] ]
When will I arrive my company if I leave in 15 minutes?	When will I arrive my company if I leave in 15 minutes ?	[IN:GET_ESTIMATED_ARRIVAL When will I arrive [SL:DESTINATION [IN:GET_LOCATION_WORK [SL:CONTACT my ] company ] ] if I leave [SL:DATE_TIME_DEPARTURE in 15 minutes ] ? ]
will I make it to the beach by noon if I leave now	will I make it to the beach by noon if I leave now	[IN:GET_ESTIMATED_ARRIVAL will I make it to [SL:DESTINATION [IN:GET_LOCATION [SL:CATEGORY_LOCATION the beach ] ] ] [SL:DATE_TIME_ARRIVAL by noon ] if I leave [SL:DATE_TIME_DEPARTURE now ] ]
If I leave Miami at noon what time will it be when I get to Jacksonville?	If I leave Miami at noon what time will it be when I get to Jacksonville ?	[IN:GET_ESTIMATED_ARRIVAL If I leave [SL:SOURCE Miami ] [SL:DATE_TIME_DEPARTURE at noon ] what time will it be when I get to [SL:DESTINATION Jacksonville ] ? ]
Can i make it to the 6:15 screening of Black Panther if I leave the the house at 545 pm via H201	Can i make it to the 6 : 15 screening of Black Panther if I leave the the house at 545 pm via H201	[IN:GET_ESTIMATED_ARRIVAL Can i make it to [SL:DESTINATION [IN:GET_EVENT the [SL:DATE_TIME 6 : 15 ] [SL:CATEGORY_EVENT screening of Black Panther ] ] ] if I leave the [SL:SOURCE [IN:GET_LOCATION_HOME the house ] ] [SL:DATE_TIME_DEPARTURE at 545 pm ] via [SL:PATH H201 ] ]
Am I going to make it to my job interview if I leave my home right now?	Am I going to make it to my job interview if I leave my home right now ?	[IN:GET_ESTIMATED_ARRIVAL Am I going to make it to [SL:DESTINATION [IN:GET_EVENT [SL:ORGANIZER_EVENT my ] [SL:CATEGORY_EVENT job interview ] ] ] if I leave [SL:SOURCE [IN:GET_LOCATION_HOME [SL:CONTACT my ] home ] ] [SL:DATE_TIME_DEPARTURE right now ] ? ]
Can I make it for the Wedding on time If I leave my sister's house at 11:30am?	Can I make it for the Wedding on time If I leave my sister 's house at 11 : 30 am ?	[IN:GET_ESTIMATED_ARRIVAL Can I make it for [SL:DESTINATION [IN:GET_EVENT [SL:CATEGORY_EVENT the Wedding ] ] ] on time If I leave [SL:SOURCE [IN:GET_LOCATION_HOME [SL:CONTACT_RELATED my ] [SL:TYPE_RELATION sister ] 's house ] ] [SL:DATE_TIME_DEPARTURE at 11 : 30 am ] ? ]
What time will I arrive at my Mom's house if I leave in five minutes?	What time will I arrive at my Mom 's house if I leave in five minutes ?	[IN:GET_ESTIMATED_ARRIVAL What time will I arrive at [SL:DESTINATION [IN:GET_LOCATION_HOME [SL:CONTACT_RELATED my ] [SL:TYPE_RELATION Mom ] 's house ] ] if I leave [SL:DATE_TIME_DEPARTURE in five minutes ] ? ]
What time will I get to Seattle if I take the freeway and leave at 2?	What time will I get to Seattle if I take the freeway and leave at 2 ?	[IN:GET_ESTIMATED_ARRIVAL What time will I get to [SL:DESTINATION Seattle ] if I take [SL:PATH [IN:GET_LOCATION [SL:CATEGORY_LOCATION the freeway ] ] ] and leave [SL:DATE_TIME_DEPARTURE at 2 ] ? ]
can I get to Ribeiro Claro by five if I leave in ten minutes?	can I get to Ribeiro Claro by five if I leave in ten minutes ?	[IN:GET_ESTIMATED_ARRIVAL can I get to [SL:DESTINATION Ribeiro Claro ] [SL:DATE_TIME_ARRIVAL by five ] if I leave [SL:DATE_TIME_DEPARTURE in ten minutes ] ? ]
Can I get from here to Galveston before 6pm?	Can I get from here to Galveston before 6 pm ?	[IN:GET_ESTIMATED_ARRIVAL Can I get from [SL:SOURCE [IN:GET_LOCATION [SL:LOCATION_USER here ] ] ] to [SL:DESTINATION Galveston ] [SL:DATE_TIME_ARRIVAL before 6 pm ] ? ]
